{
  "id": "rsy-custom",
  "name": "RSY Custom — Grok 4.5 via 9Router",
  "description": "Grok 4.5 via 9Router API",
  "provider": "9router",
  "model": "gcli/grok-4.5",
  "maxTokens": 16384,
  "temperature": 0.3,
  "apiKeyEnv": "CUSTOM_API_KEY",
  "endpoint": "http://64.235.34.80:20128/v1",
  "tokenSaving": {
    "contextTruncation": true,
    "maxContextMessages": 20
  }
}
